{
  "$schema": "https://json-schema.org/draft/2020-12/schema",
  "$id": "https://letron.local/schemas/MaterialRequestWrite.json",
  "type": "object",
  "properties": {
    "name": {
      "type": "string"
    },
    "type_section": {
      "type": "string",
      "x-frappe-options": "fa fa-pushpin"
    },
    "naming_series": {
      "type": "string"
    },
    "title": {
      "type": "string",
      "writeOnly": true
    },
    "material_request_type": {
      "type": "string",
      "enum": [
        "Purchase",
        "Material Transfer",
        "Material Issue",
        "Manufacture",
        "Subcontracting",
        "Customer Provided"
      ]
    },
    "customer": {
      "type": "string",
      "x-frappe-target-doctype": "Customer"
    },
    "column_break_2": {
      "type": "string"
    },
    "schedule_date": {
      "type": "string",
      "format": "date"
    },
    "company": {
      "type": "string",
      "x-frappe-target-doctype": "Company"
    },
    "items_section": {
      "type": "string",
      "x-frappe-options": "fa fa-shopping-cart"
    },
    "scan_barcode": {
      "type": "string",
      "x-frappe-options": "Barcode"
    },
    "items": {
      "type": "array",
      "items": {
        "$ref": "MaterialRequestItemWrite.json"
      }
    },
    "transaction_date": {
      "type": "string",
      "format": "date"
    },
    "column_break2": {
      "type": "string"
    },
    "printing_details": {
      "type": "string"
    },
    "letter_head": {
      "type": "string",
      "x-frappe-target-doctype": "Letter Head"
    },
    "select_print_heading": {
      "type": "string",
      "x-frappe-target-doctype": "Print Heading"
    },
    "terms_section_break": {
      "type": "string",
      "x-frappe-options": "fa fa-legal"
    },
    "tc_name": {
      "type": "string",
      "x-frappe-target-doctype": "Terms and Conditions"
    },
    "terms": {
      "type": "string"
    },
    "reference": {
      "type": "string"
    },
    "warehouse_section": {
      "type": "string"
    },
    "set_warehouse": {
      "type": "string",
      "x-frappe-target-doctype": "Warehouse"
    },
    "column_break5": {
      "type": "string"
    },
    "set_from_warehouse": {
      "type": "string",
      "x-frappe-target-doctype": "Warehouse"
    },
    "terms_tab": {
      "type": "string"
    },
    "more_info_tab": {
      "type": "string"
    },
    "connections_tab": {
      "type": "string"
    },
    "status_section": {
      "type": "string",
      "x-frappe-options": "fa fa-file-text"
    },
    "column_break_31": {
      "type": "string"
    },
    "column_break_35": {
      "type": "string"
    },
    "buying_price_list": {
      "type": "string",
      "x-frappe-target-doctype": "Price List"
    },
    "last_scanned_warehouse": {
      "type": "string"
    },
    "custom_letron_orchestration_id": {
      "type": "string"
    },
    "custom_lark_approval_status": {
      "type": "string"
    }
  },
  "required": [
    "company",
    "items",
    "material_request_type",
    "naming_series",
    "transaction_date"
  ],
  "additionalProperties": false,
  "x-module": "Stock"
}