{
  "naming_series": "MR-.YYYYMMDD.-.####",
  "material_request_type": "Purchase",
  "company": "Letron Việt Nam",
  "transaction_date": "2026-09-12",
  "items": [
    {
      "item_code": "CONTRACT-TEST-ITEM",
      "qty": 2,
      "schedule_date": "2026-10-12",
      "warehouse": "Cửa hàng - LTVN"
    }
  ]
}
